<xs:schema attributeFormDefault="unqualified" elementFormDefault="qualified" targetNamespace="bean" xmlns:xs="http://www.w3.org/2001/XMLSchema">
    <xs:element name="module">
        <xs:complexType>
            <xs:sequence>
                <xs:element name="bean" maxOccurs="unbounded" minOccurs="0">
                    <xs:complexType>
                        <xs:sequence>
                            <xs:element name="var" maxOccurs="unbounded" minOccurs="0">
                                <xs:complexType>
                                    <xs:simpleContent>
                                        <xs:extension base="xs:string">
                                            <xs:attribute type="xs:string" name="name" use="required"/>
                                            <xs:attribute type="xs:string" name="type" use="required"/>
                                            <xs:attribute type="xs:string" name="comment" use="optional"/>
                                            <xs:attribute name="group" use="optional">
                                                <xs:simpleType>
                                                    <xs:restriction base="xs:string">
                                                        <xs:enumeration value="c"/>
                                                        <xs:enumeration value="s"/>
                                                        <xs:enumeration value="const"/>
                                                        <xs:enumeration value="comment"/>
                                                    </xs:restriction>
                                                </xs:simpleType>
                                            </xs:attribute>
                                            <xs:attribute type="xs:string" name="tags" use="optional"/>
                                        </xs:extension>
                                    </xs:simpleContent>
                                </xs:complexType>
                            </xs:element>
                            <xs:element name="mapper" maxOccurs="unbounded" minOccurs="0">
                                <xs:complexType>
                                    <xs:sequence>
                                        <xs:element name="option" maxOccurs="2" minOccurs="2">
                                            <xs:complexType>
                                                <xs:attribute name="name" use="required">
                                                    <xs:simpleType>
                                                        <xs:restriction base="xs:string">
                                                            <xs:enumeration value="type"/>
                                                            <xs:enumeration value="constructor"/>
                                                        </xs:restriction>
                                                    </xs:simpleType>
                                                </xs:attribute>
                                                <xs:attribute type="xs:string" name="value" use="required"/>
                                            </xs:complexType>
                                        </xs:element>
                                    </xs:sequence>
                                    <xs:attribute name="target" use="required">
                                        <xs:simpleType>
                                            <xs:restriction base="xs:string">
                                                <xs:enumeration value="client"/>
                                                <xs:enumeration value="server"/>
                                            </xs:restriction>
                                        </xs:simpleType>
                                    </xs:attribute>
                                    <xs:attribute name="codeTarget" use="required">
                                        <xs:simpleType>
                                            <xs:restriction base="xs:string">
                                                <xs:enumeration value="cs-bin,cs-dotnet-json,cs-simple-json"/>
                                            </xs:restriction>
                                        </xs:simpleType>
                                    </xs:attribute>
                                </xs:complexType>
                            </xs:element>
                        </xs:sequence>
                        <xs:attribute type="xs:string" name="name" use="required"/>
                        <xs:attribute type="xs:string" name="comment" use="optional"/>
                        <xs:attribute type="xs:boolean" name="valueType" use="optional"/>
                        <xs:attribute type="xs:string" name="sep" use="optional"/>
                        <xs:attribute type="xs:string" name="alias" use="optional"/>
                        <xs:attribute type="xs:string" name="parent" use="optional"/>
                        <xs:attribute name="group" use="optional">
                            <xs:simpleType>
                                <xs:restriction base="xs:string">
                                    <xs:enumeration value="c"/>
                                    <xs:enumeration value="s"/>
                                </xs:restriction>
                            </xs:simpleType>
                        </xs:attribute>
                    </xs:complexType>
                </xs:element>
            </xs:sequence>
            <xs:attribute type="xs:string" name="name" use="required"/>
        </xs:complexType>
    </xs:element>
</xs:schema>
